{
  "unit_designation": "No. 154 Squadron RAF",
  "unit_type": "fighter_squadron",
  "parent_formation": "Eastern Air Command, RAF (Operation Torch forces)",
  "nation": "british",
  "quarter": "1942-Q4",
  "assigned_to_ground": "First Army (supporting Operation Torch)",
  "commander": {
    "rank": "Squadron Leader",
    "name": "Don Carlson",
    "kills": 9,
    "notes": "New Zealander. 4 victories with 74 Squadron in 1941, 5 victories with 154 Squadron in North Africa (including Ju 88 on 15 November 1942)"
  },
  "base": "Maison Blanche airfield, Algiers, Algeria",
  "personnel": {
    "pilots": 18,
    "ground_crew": 165,
    "mechanics": 45,
    "armorers": 25,
    "signals": 12,
    "total": 265
  },
  "aircraft": {
    "total": 18,
    "operational": 16,
    "damaged": 2,
    "reserve": 0,
    "variants": [
      {
        "designation": "Supermarine Spitfire Mk VA",
        "count": 6,
        "operational": 5,
        "witw_id": null
      },
      {
        "designation": "Supermarine Spitfire Mk VB",
        "count": 12,
        "operational": 11,
        "witw_id": null
      }
    ]
  },
  "ordnance": {
    "ammunition_rounds": 84000,
    "cannon_shells": 10800,
    "fuel_liters": 45000,
    "bombs": [],
    "drop_tanks": 18
  },
  "ground_support_vehicles": {
    "fuel_bowsers": 6,
    "bomb_dollies": 15,
    "trucks": 28,
    "staff_cars": 3,
    "recovery_vehicles": 2
  },
  "supply": {
    "fuel_reserves_days": 10,
    "ammunition_reserves_days": 14,
    "sortie_rate_per_day": 2.0,
    "operational_radius_km": 350,
    "supply_status": "adequate"
  },
  "operations_history": [
    {
      "date": "1942-11-10",
      "operation": "Operation Torch - Algeria landing support",
      "sorties": 24,
      "claims": 2,
      "losses": 0,
      "mission_type": "fighter sweep"
    },
    {
      "date": "1942-11-15",
      "operation": "Air defense of Algiers convoy",
      "sorties": 18,
      "claims": 1,
      "losses": 0,
      "mission_type": "intercept",
      "notes": "Squadron Leader Don Carlson shot down Ju 88 bomber"
    },
    {
      "date": "1942-11-28",
      "operation": "Convoy protection patrol",
      "sorties": 22,
      "claims": 4,
      "losses": 0,
      "mission_type": "intercept",
      "notes": "Flying Officer 'Paddy' Chambers shot down 4 of 5 Italian SM.79 aircraft intercepted"
    }
  ],
  "metadata": {
    "confidence": 75,
    "sources": [
      "History of War: No. 154 Squadron (RAF) during the Second World War (historyofwar.org)",
      "War History: Tunisia and the End in Africa, November 1942-May 1943 Part I (warhistory.org)",
      "Military Wiki: No. 154 Squadron RAF",
      "Wikipedia: Supermarine Spitfire variants specifications",
      "Various web sources: RAF squadron organization 1942"
    ],
    "extraction_date": "2025-10-26",
    "tier": "review_recommended",
    "notes": "Good Tier 2 source corroboration for unit designation, commander, aircraft variants, operational dates, and specific combat actions. Limited data on exact personnel strength (estimated from standard RAF establishment). Squadron became operational 24 February 1942, participated in Dieppe raid, then deployed to North Africa for Operation Torch in November 1942. Operated Spitfire VA/VB from February 1942-January 1943. Notable actions include Chambers' quadruple SM.79 victory on 28 November 1942. First two weeks: 19 Luftwaffe bombers claimed destroyed, 9 damaged.",
    "witw_validation": "RAF squadron data validation pending"
  }
}
