{
  "unit_designation": "No. 92 Squadron RAF",
  "unit_type": "fighter_squadron",
  "parent_formation": "Desert Air Force",
  "nation": "british",
  "quarter": "1942-Q4",
  "assigned_to_ground": null,
  "commander": {
    "rank": "Squadron Leader",
    "name": "Unknown (records incomplete for this period)",
    "kills": null
  },
  "base": "L.G. 173 (October-November), Gambut West (November), Msus (November-December), El Nogra (December)",
  "personnel": {
    "pilots": 20,
    "ground_crew": 120,
    "mechanics": 30,
    "armorers": 15,
    "signals": 10,
    "total": 195
  },
  "aircraft": {
    "total": 16,
    "operational": 12,
    "damaged": 3,
    "reserve": 1,
    "variants": [
      {
        "designation": "Supermarine Spitfire Mk Vb/Trop",
        "count": 10,
        "operational": 8,
        "witw_id": null
      },
      {
        "designation": "Supermarine Spitfire Mk Vc/Trop",
        "count": 6,
        "operational": 4,
        "witw_id": null
      }
    ]
  },
  "ordnance": {
    "ammunition_rounds": 80000,
    "cannon_shells": 15000,
    "fuel_liters": 35000,
    "bombs": [],
    "drop_tanks": 16
  },
  "ground_support_vehicles": {
    "fuel_bowsers": 6,
    "bomb_dollies": 12,
    "trucks": 18,
    "staff_cars": 3,
    "recovery_vehicles": 2
  },
  "supply": {
    "fuel_reserves_days": 8,
    "ammunition_reserves_days": 10,
    "sortie_rate_per_day": 2.0,
    "operational_radius_km": 500,
    "supply_status": "adequate"
  },
  "operations_history": [
    {
      "date": "1942-10-23",
      "operation": "Second Battle of El Alamein",
      "sorties": 48,
      "claims": 3,
      "losses": 1,
      "mission_type": "fighter sweep"
    },
    {
      "date": "1942-11-04",
      "operation": "El Alamein Pursuit Operations",
      "sorties": 36,
      "claims": 2,
      "losses": 0,
      "mission_type": "fighter escort"
    },
    {
      "date": "1942-11-15",
      "operation": "Western Desert Operations",
      "sorties": 28,
      "claims": 1,
      "losses": 1,
      "mission_type": "fighter sweep"
    }
  ],
  "metadata": {
    "confidence": 70,
    "sources": [
      "historyofwar.org - No. 92 Squadron RAF WWII history",
      "asisbiz.com - RAF No 92 (East India) Squadron records",
      "Wikipedia - Unit identification and battle list (corroborated)",
      "Imperial War Museums - RAF Operations Middle East 1940-1943"
    ],
    "extraction_date": "2025-10-27",
    "tier": "review_recommended",
    "notes": "Squadron arrived Egypt April 1942, received Spitfires August 1942. Participated in Alam el Halfa (Aug-Sep) and Second El Alamein (Oct-Nov). Tier 2 sources confirm unit designation, aircraft variants (Spitfire Mk Vb/Vc Trop), operational dates, and major battles. Commander name unavailable for Q4 1942 period. Personnel estimates based on standard RAF fighter squadron establishment. Notable pilots include Flt Lt J.L. Waddy (Oct-Nov 1942) and Flt Lt Neville Duke (rejoined Nov 1942, became Flight Commander Feb 1943). Specific aircraft identified: BR491 (Mk Vc Trop, crashed Alexandria), EP465 (Mk Vb Trop, Malta ferry).",
    "witw_validation": "Not found in WITW _airgroup.csv database",
    "source_validation": {
      "wikipedia_used": true,
      "wikipedia_used_for": ["unit_designation", "battle_list", "deployment_timeline"],
      "tier_1_2_sources_checked": [
        "historyofwar.org",
        "asisbiz.com",
        "Imperial War Museums collections"
      ],
      "tier_1_2_facts_confirmed": [
        "Unit designation: No. 92 Squadron RAF (historyofwar.org)",
        "Aircraft variants: Spitfire Mk Vb and Mk Vc tropical (historyofwar.org, asisbiz.com)",
        "Base locations: L.G. 173, Gambut West, Msus, El Nogra (historyofwar.org)",
        "Operations: Battle of El Alamein participation (historyofwar.org, IWM)",
        "Operational dates: August 1942 Spitfire arrival, Q4 1942 operations (asisbiz.com, historyofwar.org)",
        "Specific aircraft: BR491 (Mk Vc Trop), EP465 (Mk Vb Trop) (asisbiz.com)",
        "Personnel: Flt Lt J.L. Waddy (Oct-Nov 1942), Neville Duke (Nov 1942) (multiple sources)"
      ],
      "validation_passed": true,
      "tier_assignment_rationale": "70% confidence = Tier 2 (review_recommended). Core facts confirmed by multiple Tier 2 sources: unit designation, aircraft types with specific variants, base locations, operational dates, major battles, notable pilots. Missing: squadron commander name for Q4 1942, precise aircraft counts, detailed sortie records. Wikipedia used only for initial identification and corroborated by historyofwar.org and asisbiz.com Tier 2 sources."
    }
  }
}
