{
  "unit_designation": "No. 1 Squadron SAAF",
  "unit_type": "fighter_squadron",
  "parent_formation": "No. 243 Wing, No. 212 Group, Air Headquarters Western Desert",
  "nation": "british",
  "quarter": "1942-Q4",
  "assigned_to_ground": null,
  "commander": {
    "rank": "Major",
    "name": "G. J. \"Lemmie\" le Mesurier"
  },
  "base": "LG.172 (October-November 1942), LG.05 (November 1942), Martuba (November 1942)",
  "personnel": {
    "pilots": 18,
    "ground_crew": 80,
    "mechanics": 25,
    "armorers": 15,
    "signals": 8,
    "total": 146
  },
  "aircraft": {
    "total": 18,
    "operational": 14,
    "damaged": 2,
    "reserve": 2,
    "variants": [
      {
        "designation": "Hawker Hurricane Mk IIC/Trop",
        "count": 18,
        "operational": 14,
        "witw_id": 667
      }
    ]
  },
  "ordnance": {
    "ammunition_rounds": 45000,
    "cannon_shells": 7200,
    "fuel_liters": 18000,
    "bombs": [
      {
        "type": "GP",
        "weight_kg": 113,
        "count": 36
      },
      {
        "type": "GP",
        "weight_kg": 227,
        "count": 18
      }
    ],
    "drop_tanks": 12
  },
  "ground_support_vehicles": {
    "fuel_bowsers": 3,
    "bomb_dollies": 8,
    "trucks": 12,
    "staff_cars": 2,
    "recovery_vehicles": 1
  },
  "supply": {
    "fuel_reserves_days": 8,
    "ammunition_reserves_days": 10,
    "sortie_rate_per_day": 2.0,
    "operational_radius_km": 480,
    "supply_status": "adequate"
  },
  "operations_history": [
    {
      "date": "1942-10-23",
      "operation": "Second Battle of El Alamein - Opening Phase",
      "sorties": 24,
      "claims": 2,
      "losses": 0,
      "mission_type": "fighter sweep"
    },
    {
      "date": "1942-10-24",
      "operation": "Second Battle of El Alamein - Breakout Phase",
      "sorties": 28,
      "claims": 4,
      "losses": 1,
      "mission_type": "ground attack"
    },
    {
      "date": "1942-11-04",
      "operation": "Second Battle of El Alamein - Pursuit Phase",
      "sorties": 22,
      "claims": 1,
      "losses": 0,
      "mission_type": "fighter sweep"
    }
  ],
  "metadata": {
    "confidence": 72,
    "sources": [
      "No. 1 Squadron (SAAF) during the Second World War, historyofwar.org (Tier 2)",
      "Imperial War Museums Collection: Major G J le Mesurier, BG971 'AX-V' (Tier 1)",
      "The National Archives UK: No 1 Squadron SAAF Operations Record Book, AIR 27/9 (Tier 1)",
      "Stewart 'Bomb' Finney logbook, 19 October 1942 (Tier 2)",
      "WITW _airgroup.csv: No.1 SAAF FB Sqn, line 1452"
    ],
    "extraction_date": "2025-10-27",
    "tier": "review_recommended",
    "notes": "Tier 2 extraction (72% confidence). Commander Major le Mesurier returned to squadron September 1942 after being shot down 4 July 1942. Hurricane Mk.IIC aircraft received mid-September 1942 with modified 2x20mm cannon armament (outer cannons removed). Squadron tasked with protecting Allied armor during El Alamein breakout phase, destroying multiple Ju 87 Stukas. Transitioned to Spitfire Mk.VC in late November 1942 after battle. Personnel and ordnance estimates based on standard RAF/SAAF fighter squadron establishment 1942.",
    "witw_validation": "Confirmed in WITW _airgroup.csv line 1452 as 'No.1 SAAF FB Sqn' with airType 667"
  }
}
