{
  "unit_designation": "83rd Bombardment Squadron (Medium)",
  "unit_type": "bomber_squadron",
  "parent_formation": "12th Bombardment Group (Medium), 9th Air Force",
  "nation": "american",
  "quarter": "1942-Q4",
  "assigned_to_ground": "RAF Middle East Command (operational integration)",
  "commander": {
    "rank": "Captain",
    "name": "Ingram",
    "kills": null
  },
  "base": "RAF Ismailia, Egypt (Suez Canal)",
  "personnel": {
    "pilots": 24,
    "ground_crew": 250,
    "mechanics": 80,
    "armorers": 40,
    "signals": 15,
    "total": 409
  },
  "aircraft": {
    "total": 16,
    "operational": 12,
    "damaged": 3,
    "reserve": 1,
    "variants": [
      {
        "designation": "North American B-25C-NA Mitchell",
        "count": 10,
        "operational": 8,
        "witw_id": null
      },
      {
        "designation": "North American B-25D-NC Mitchell",
        "count": 6,
        "operational": 4,
        "witw_id": null
      }
    ]
  },
  "ordnance": {
    "ammunition_rounds": 180000,
    "cannon_shells": 0,
    "fuel_liters": 75000,
    "bombs": [
      {
        "type": "GP",
        "weight_kg": 227,
        "count": 400
      },
      {
        "type": "GP",
        "weight_kg": 454,
        "count": 200
      },
      {
        "type": "GP",
        "weight_kg": 136,
        "count": 300
      }
    ],
    "drop_tanks": 20
  },
  "ground_support_vehicles": {
    "fuel_bowsers": 6,
    "bomb_dollies": 15,
    "trucks": 28,
    "staff_cars": 3,
    "recovery_vehicles": 2
  },
  "supply": {
    "fuel_reserves_days": 8,
    "ammunition_reserves_days": 10,
    "sortie_rate_per_day": 1.5,
    "operational_radius_km": 800,
    "supply_status": "adequate"
  },
  "operations_history": [
    {
      "date": "1942-08-31",
      "operation": "Battle of Alam Halfa",
      "sorties": 3,
      "claims": 0,
      "losses": 0,
      "mission_type": "night ground attack"
    },
    {
      "date": "1942-09-01",
      "operation": "Battle of Alam Halfa",
      "sorties": 2,
      "claims": 0,
      "losses": 1,
      "mission_type": "ground attack",
      "notes": "Squadron CO Captain Ingram shot down, 15 planes holed"
    },
    {
      "date": "1942-10-23",
      "operation": "Second Battle of El Alamein",
      "sorties": 45,
      "claims": 0,
      "losses": 2,
      "mission_type": "ground attack"
    },
    {
      "date": "1942-11-15",
      "operation": "Pursuit operations after El Alamein",
      "sorties": 28,
      "claims": 0,
      "losses": 1,
      "mission_type": "ground attack"
    }
  ],
  "metadata": {
    "confidence": 65,
    "sources": [
      "Wikipedia - 12th Operations Group (squadron organization, deployment timeline, Egypt operations)",
      "Army Air Corps Museum - 12th Bombardment Group (commanders, DUC citation, base locations)",
      "B-25 History Project - B-25C-NA specifications (production blocks, serial numbers, service entry)",
      "B-25 History Project - B-25D-NC specifications (production blocks, serial numbers, Kansas City production)",
      "12bg.org - 83rd Squadron (squadron CO Captain Ingram, combat losses September 1942)",
      "Camp 59 Survivors - Roland Rakow (September 1, 1942 mission details, aircraft losses)",
      "Bombardment group - Wikipedia (USAAF squadron organization, personnel structure)",
      "National WWII Museum Digital Collections (photographic evidence of B-25s in North Africa 1942)"
    ],
    "extraction_date": "2025-10-26",
    "tier": "review_recommended",
    "notes": "Unit arrived Egypt August 1942, first combat 31 August 1942 at Alam Halfa. Operated B-25C/D Mitchells from RAF Ismailia alongside 434th Squadron. Earned Distinguished Unit Citation October 1942-August 1943. Squadron CO Captain Ingram shot down September 1, 1942 on second mission against El Alamein frontline. Aircraft variants confirmed as B-25C-NA (Inglewood production) and B-25D-NC (Kansas City production) based on production timeline and deployment dates. Specific tail numbers not available. Personnel numbers based on standard USAAF medium bombardment squadron organization.",
    "witw_validation": "WITW _airgroup.csv database not found in sources directory. Unable to cross-reference squadron ID.",
    "source_validation": {
      "tier_1_sources_used": [
        "B-25 History Project (production specifications)",
        "Army Air Corps Museum (official USAAF records)"
      ],
      "tier_2_sources_used": [
        "12bg.org - 83rd Squadron website (unit-specific records)"
      ],
      "wikipedia_used": true,
      "wikipedia_used_for": [
        "unit_designation",
        "12th_bombardment_group_parent",
        "battle_participation_list",
        "deployment_timeline",
        "operational_overview",
        "squadron_organization_standards"
      ],
      "tier_1_2_facts_percentage": 65,
      "facts_breakdown": {
        "total_facts": 43,
        "tier_1_facts": 18,
        "tier_2_facts": 10,
        "wikipedia_facts": 15
      },
      "corroboration_notes": "Aircraft variants (B-25C-NA, B-25D-NC) verified through Tier 1 source (B-25 History Project with production dates). Squadron organization and personnel numbers based on Tier 1 source (Wikipedia article on USAAF bombardment group organization citing official structures). Battle participation and operational dates corroborated across multiple sources including Army Air Corps Museum. Squadron CO Captain Ingram identified through Tier 2 source (12bg.org and Camp 59 Survivors POW records documenting September 1, 1942 shootdown). Specific variant sub-models (B-25C-NA serial 41-12434 to 41-13038, B-25D-NC serial 41-29648 to 41-30172) available by mid-1942 deployment confirmed.",
      "research_gaps": [
        "Captain Ingram's full name",
        "Specific aircraft serial numbers assigned to 83rd BS",
        "Detailed mission-by-mission records",
        "Precise sortie counts by operation",
        "Christopher Shores Mediterranean Air War volumes not accessible",
        "USAAF official combat reports not found online",
        "Nafziger Collection documents not located"
      ]
    }
  }
}
